{
  "$schema": "https://json-schema.org/draft/2020-12/schema",
  "$id": "https://notemartin-study-translate.local/schemas/glossary.schema.json",
  "x-schema-version": "1.2.0",
  "title": "Glosario de traducción",
  "description": "Modela términos por dominio y sentido. Permite que un mismo término origen tenga varias entradas con dominios o sentidos distintos y equivalentes diferentes, sin colisión. La unicidad de la terna (source_term, domain, sense) y la disyunción entre allowed_variants y forbidden_forms se verifican en la implementación tras la validación del esquema.",
  "type": "object",
  "additionalProperties": false,
  "required": ["version", "frozen", "allowed_languages", "entries"],
  "properties": {
"version": {
      "description": "Versión del glosario. La congela y la incrementa approve_pilot.py al aprobar el piloto.",
      "type": "integer",
      "minimum": 1
    },
    "approved_at": {
      "description": "Momento en que se congeló el glosario. Lo escribe approve_pilot.py; ausente mientras el glosario sigue en borrador.",
      "type": "string",
      "format": "date-time"
    },
    "frozen": {
      "description": "Indica si el glosario está congelado para esta ejecución. Un glosario congelado no acepta cambios sin invalidar los segmentos afectados.",
      "type": "boolean"
    },
    "allowed_languages": {
      "description": "Idiomas permitidos para los equivalentes del glosario. Códigos BCP-47.",
      "type": "array",
      "minItems": 1,
      "items": {
        "type": "string",
        "pattern": "^[a-zA-Z]{2,3}(-[a-zA-Z0-9]{2,8})*$"
      }
    },
    "entries": {
      "description": "Entradas del glosario. La unicidad se define por la terna (source_term, domain, sense).",
      "type": "array",
      "items": { "$ref": "#/$defs/entry" }
    }
  },
  "$defs": {
    "entry": {
      "type": "object",
      "additionalProperties": false,
      "required": [
        "id",
        "source_term",
        "sense",
        "preferred",
        "preservation_policy",
        "context_examples",
        "justification",
        "decided_by",
        "decided_at"
      ],
      "properties": {
        "id": {
          "description": "Identificador estable con formato g-XXXX.",
          "type": "string",
          "pattern": "^g-[0-9a-f]{4}$"
        },
        "source_term": {
          "description": "Término en el idioma de origen. No vacío.",
          "type": "string",
          "minLength": 1
        },
        "domain": {
          "description": "Categoría de producto o área técnica. Null indica término global. Libre para no romper la extensibilidad.",
          "type": ["string", "null"],
          "default": null
        },
        "sense": {
          "description": "Descriptor textual obligatorio del sentido operativo. Distingue sentidos diferentes de un mismo término.",
          "type": "string",
          "minLength": 1
        },
        "preferred": {
          "description": "Equivalente preferido para el idioma configurado.",
          "type": "object",
          "additionalProperties": false,
          "required": ["lang", "term"],
          "properties": {
            "lang": {
              "type": "string",
              "pattern": "^[a-zA-Z]{2,3}(-[a-zA-Z0-9]{2,8})*$"
            },
            "term": {
              "type": "string",
              "minLength": 1
            }
          }
        },
        "allowed_variants": {
          "description": "Variantes aceptadas además del equivalente preferido.",
          "type": "array",
          "default": [],
          "items": {
            "type": "string",
            "minLength": 1
          },
          "uniqueItems": true
        },
        "forbidden_forms": {
          "description": "Formas prohibidas que no deben usarse para este término.",
          "type": "array",
          "default": [],
          "items": {
            "type": "string",
            "minLength": 1
          },
          "uniqueItems": true
        },
        "preservation_policy": {
          "description": "Política de preservación del término original.",
          "type": "string",
          "enum": [
            "translate",
            "keep-original",
            "translate-with-original-on-first-mention"
          ]
        },
        "context_examples": {
          "description": "Ejemplos de contexto donde aparece el término. Mínimo uno obligatorio.",
          "type": "array",
          "minItems": 1,
          "items": {
            "type": "object",
            "additionalProperties": false,
            "required": ["document_id", "segment_id", "before", "after", "note"],
            "properties": {
              "document_id": {
                "type": "string",
                "minLength": 1
              },
              "segment_id": {
                "type": "string",
                "minLength": 1
              },
              "before": {
                "type": "string"
              },
              "after": {
                "type": "string"
              },
              "note": {
                "type": "string"
              }
            }
          }
        },
        "justification": {
          "description": "Justificación de la decisión. No repite el equivalente; documenta el motivo.",
          "type": "string",
          "minLength": 1
        },
        "decided_by": {
          "description": "Identificador de quien aprobó la entrada.",
          "type": "string",
          "minLength": 1
        },
        "decided_at": {
          "description": "Fecha ISO 8601 de la decisión.",
          "type": "string",
          "format": "date-time"
        },
        "provenance": {
          "description": "Procedencia de la entrada cuando el término se importa de terminología oficial autorizada (fase 096). La escribe scripts/term_provenance.py; no sustituye la documentación que se traduce.",
          "type": "object",
          "additionalProperties": false,
          "required": ["source", "source_version"],
          "properties": {
            "source": {
              "description": "Nombre de la fuente de terminología.",
              "type": "string",
              "minLength": 1
            },
            "source_version": {
              "description": "Versión de esa fuente.",
              "type": "string",
              "minLength": 1
            },
            "url": {
              "description": "Ubicación de la fuente, si es pública.",
              "type": "string",
              "minLength": 1
            },
            "importer": {
              "description": "Quién incorporó el término.",
              "type": "string",
              "minLength": 1
            },
            "fetched_at": {
              "description": "Fecha ISO 8601 de la incorporación.",
              "type": "string",
              "format": "date-time"
            }
          }
        }
      },
      "allOf": [
        {
          "description": "Si preservation_policy es keep-original, allowed_variants debe estar vacío.",
          "if": {
            "properties": {
              "preservation_policy": { "const": "keep-original" }
            },
            "required": ["preservation_policy"]
          },
          "then": {
            "properties": {
              "allowed_variants": {
                "maxItems": 0
              }
            }
          }
        }
      ]
    }
  }
}
